receiver_name,receiver_address,pincode,phone,email,gstin,product_descriptions,hsn_sac_codes,quantities,total_values
John Doe,"123 Main Street, Bangalore, Karnataka",560001,9.19877E+11,john@example.com,29ABCDE1234F1Z5,"Website Development, SEO Services","998314, 998316","1, 2","59000, 23600"
Jane Smith,"456 Park Avenue, Connaught Place, Delhi",110001,9.19877E+11,jane@example.com,,Consulting Service,998314,5,118000
Bob Wilson,"789 Lake Road, Andheri, Mumbai, Maharashtra",400001,9.19877E+11,bob@example.com,27XYZAB5678K1Z9,"Product A, Product B, Product C","998315, 998315, 998316","2, 1, 3","2360, 1180, 3540"
Alice Johnson,"321 Garden Street, Pune, Maharashtra",411001,9.19877E+11,alice@example.com,,"Training Session, Workshop Materials","998314, 998316","10, 5","59000, 11800"
Rajesh Kumar,"555 Tech Park, Whitefield, Bangalore, Karnataka",560066,9.19877E+11,rajesh@example.com,29XYZCD9012E1Z3,"Software License, Support Package","998314, 998314","1, 1","118000, 59000"
